Address,lon,lat
"HUA GUAN GARDENS, HUA GUAN CRESCENT, Singapore",103.78463,1.335804
"HOW SUN GARDEN, HOW SUN AVENUE, Singapore",103.8788926,1.34455
"HOW SUN GARDEN, LORONG HOW SUN, Singapore",103.8799158,1.345263
"HOOVER PARK, CHUN TIN ROAD, Singapore",103.7730586,1.3438729
"HOOVER PARK, LORONG PISANG HIJAU, Singapore",103.7730586,1.3438729
"HOOVER PARK, LORONG PISANG ASAM, Singapore",103.7730586,1.3438729
"HOOVER PARK, LORONG PISANG EMAS, Singapore",103.7730586,1.3438729
"HOOVER PARK, LORONG PISANG BATU, Singapore",103.7730586,1.3438729
"HONG KONG PARK, HUA GUAN AVENUE, Singapore",103.819836,1.352083
"HONG KONG PARK, STONE AVENUE, Singapore",103.819836,1.352083
"HONG KONG PARK, SIAN TUAN AVENUE, Singapore",103.819836,1.352083
"HONG HENG TERRACE, THONG BEE ROAD, Singapore",103.8169022,1.4038738
"HOMES AT EASTWOOD PLACE, EASTWOOD PLACE, Singapore",103.9562737,1.3221148
"HOLLLAND GROVE PARK, JALAN KEBAYA, Singapore",103.7795862,1.3145115
"HOLLAND GROVE PARK, HOLLAND GROVE DRIVE, Singapore",103.7803512,1.3137474
"HOLLAND GROVE PARK, HOLLAND GROVE WALK, Singapore",103.7812628,1.3148106
"HOLLAND GROVE, HOLLAND GROVE VIEW, Singapore",103.7784682,1.3137981
"HOLLAND GREEN, HOLLAND GREEN, Singapore",103.7841252,1.3259983
"HOLLAND GARDENS, MOONBEAM WALK, Singapore",103.7815344,1.3187792
"HOLLAND GARDENS, MOONBEAM VIEW, Singapore",103.7817932,1.3180393
"HOLLAND GARDENS, MOONBEAM DRIVE, Singapore",103.7824376,1.3176976
"HOLLAND GARDENS, MOONBEAM TERRACE, Singapore",103.7829701,1.3177648
"HOCK SWEE HILL, BEGONIA DRIVE, Singapore",103.8628725,1.3891492
"HOCK SWEE HILL, BEGONIA CRESCENT, Singapore",103.8628725,1.3891492
"HOCK SWEE HILL, BEGONIA TERRACE, Singapore",103.8628725,1.3891492
"HOCK SWEE HILL, BEGONIA ROAD, Singapore",103.8628725,1.3891492
"HOCK SENG PARK, JALAN JAMBU AYER, Singapore",103.7873417,1.3356024
"HOCK SENG PARK, JALAN JAMBU MAWAR, Singapore",103.7873417,1.3356024
"HOCK SENG PARK, JALAN JAMBU BATU, Singapore",103.7873417,1.3356024
"HILLVIEW VILLAS, HILLVIEW DRIVE, Singapore",103.7604481,1.354769
"HILLVIEW VILLAS, HILLVIEW CRESCENT, Singapore",103.7592802,1.3541856
"HILLVIEW VILLAS, HILLVIEW WAY, Singapore",103.7597581,1.3539052
"HILLVIEW GARDEN ESTATE, ELIZABETH DRIVE, Singapore",103.7628946,1.3606969
"HILLVIEW GARDEN ESTATE, JALAN GUMILANG, Singapore",103.7583548,1.3576165
"HILLVIEW GARDEN ESTATE, JALAN REMAJA, Singapore",103.7583548,1.3576165
"HILLVIEW GARDEN ESTATE, JALAN INTAN, Singapore",103.7583548,1.3576165
"HILLVIEW GARDEN ESTATE, JALAN DERMAWAN, Singapore",103.7583548,1.3576165
"HILLVIEW GARDEN ESTATE, CHU YEN STREET, Singapore",103.7583548,1.3576165
"HILLVIEW GARDEN ESTATE, CHU LIN ROAD, Singapore",103.7583548,1.3576165
"HILLVIEW GARDEN ESTATE, JALAN ZAMRUD, Singapore",103.7583548,1.3576165
"HILLVIEW ESTATE, JALAN ZAMRUD, Singapore",103.7623581,1.3599648
"HILLVIEW ESTATE, JALAN DERMAWAN, Singapore",103.7583548,1.3576165
"HILLCREST PARK, HILLCREST ROAD, Singapore",103.8079635,1.3321387
"HILLCREST PARK, GREENVIEW CRESCENT, Singapore",103.8061648,1.3338845
"HILLCREST PARK, GREENDALE AVENUE, Singapore",103.8066892,1.3319514
"HILLCREST PARK, GREENWOOD AVENUE, Singapore",103.8051491,1.3345112
"HILLCREST PARK, GREENMEAD AVENUE, Singapore",103.80719,1.3340208
"HIGHLAND ROW, SIRAT ROAD, Singapore",103.819836,1.352083
"HIGHLAND COTTAGES, HIGHLAND WALK, Singapore",103.87931,1.359539
"HIGHGATE PARK, HIGHGATE CRESCENT, Singapore",103.7660685,1.3405165
"HIGHGATE PARK, HIGHGATE WALK, Singapore",103.7660685,1.3405165
"HERITAGE 9, KOON SENG ROAD, Singapore",103.9038085,1.3112842
"HENRY PARK, GROVE DRIVE, Singapore",103.7831632,1.3162441
"HENRY PARK, GROVE AVENUE, Singapore",103.819836,1.352083
"HENRY PARK, GROVE CRESCENT, Singapore",103.7831632,1.3162441
"HENRY PARK, MOUNT SINAI ROAD, Singapore",103.7831632,1.3162441
"HENRY PARK, HOLLAND GROVE ROAD, Singapore",103.7831632,1.3162441
"HENLEY GARDENS, JALAN ARIF, Singapore",103.884382,1.3680327
"HEETON PARK, THONG SOON GREEN, Singapore",103.8194161,1.3986178
"HEETON CLASSIC, THONG SOON GREEN, Singapore",103.8194161,1.3986178
"HEETON CLASS, THONG SOON GREEN, Singapore",103.8194161,1.3986178
"HAZEL PARK TERRACE, HAZEL PARK TERRACE, Singapore",103.764282,1.3717218
"HAUS@SERANGOON GARDEN, SERANGOON GARDEN TERRACE, Singapore",103.8605311,1.3657261
"HAUS@SERANGOON GARDEN, SERANGOON GARDEN RISE, Singapore",103.860358,1.3651992
"HAUS@SERANGOON GARDEN, SERANGOON GARDEN DRIVE, Singapore",103.8601675,1.3646599
"HAUS@SERANGOON GARDEN, SERANGOON GARDEN PLACE, Singapore",103.8599875,1.3641468
"HAUS@SERANGOON GARDEN, SERANGOON GARDEN CLOSE, Singapore",103.8597809,1.3636518
"HARVEY VIEW, HARVEY CRESCENT, Singapore",103.9543644,1.3406011
"HARVEY VIEW, HARVEY AVENUE, Singapore",103.9544544,1.3384157
"HAPPY PARK, THOMSON WALK, Singapore",103.819836,1.352083
"HAPPY GARDENS, HAPPY AVENUE EAST, Singapore",103.8813564,1.3300721
"HAPPY ESTATE, THOMSON HEIGHTS, Singapore",103.8311537,1.377192
"HAPPY ESTATE, THOMSON VIEW, Singapore",103.8307351,1.3766451
"HAI SING PARK, HAI SING CRESCENT, Singapore",103.8936825,1.3647934
"HAI SING PARK, HAI SING ROAD, Singapore",103.8934211,1.3657267
"GUAN SOON VILLAS, GUAN SOON AVENUE, Singapore",103.9536234,1.3378585
"GUAN SOON TERRACE, GUAN SOON AVENUE, Singapore",103.9536234,1.3378585
"GREENWOOD VILLAS, GREENWOOD WALK, Singapore",103.8058849,1.3337741
"GREENRIDGE, GREENRIDGE CRESCENT, Singapore",103.7659398,1.334802
"GREENBANK PARK, GREENBANK PARK, Singapore",103.7888645,1.3478931
"GREEN SPRINGS, GERALD CRESCENT, Singapore",103.8762158,1.3864695
"GREEN PARK, JALAN LIMAU KASTURI, Singapore",103.9457529,1.3243049
"GREEN HILL ESTATE, JALAN SUASA, Singapore",103.819836,1.352083
"GREEN HILL ESTATE, CHESTNUT CLOSE, Singapore",103.819836,1.352083
"GREEN HILL ESTATE, CHESTNUT CRESCENT, Singapore",103.819836,1.352083
"GREEN HILL ESTATE, CHESTNUT DRIVE, Singapore",103.819836,1.352083
"GRACE PARK, GRACE PARK, Singapore",103.8688217,1.3576617
"GRACE GARDEN, LORONG L TELOK KURAU, Singapore",103.819836,1.352083
"GOVT CO-OP HOUSING ESTATE, ROCHDALE ROAD, Singapore",103.8837495,1.3434645
"GOODLINK PARK, GOODLINK PARK, Singapore",103.8254424,1.4266303
"GOLDWOOD GARDENS, SEMBAWANG PLACE, Singapore",103.8247125,1.4387513
"GOLDLEAF GARDENS, LORONG M TELOK KURAU, Singapore",103.9150033,1.3115803
"GOLDILL GARDENS, GOLDHILL AVENUE, Singapore",103.8319399,1.3192664
"GOLDHILL GARDENS, GOLDHILL RISE, Singapore",103.8319399,1.3192664
"GOLDHILL GARDENS, GOLDHILL VIEW, Singapore",103.8319399,1.3192664
"GOLDHILL GARDENS, GOLDHILL DRIVE, Singapore",103.8319399,1.3192664
"GOLDHILL GARDENS, GOLDHILL PLACE, Singapore",103.8319399,1.3192664
"GOLDHILL GARDENS, GOLDHILL AVENUE, Singapore",103.8319399,1.3192664
"GOLDHILL GARDEN, GOLDHILL RISE, Singapore",103.8319399,1.3192664
"GOLDENHILL VILLAS, GOLDEN DRIVE, Singapore",103.819836,1.352083
"GOLDENHILL VILLAS, GOLDEN WALK, Singapore",103.8616124,1.355893
"GOLDEN RISE ESTATE, KISMIS PLACE, Singapore",103.7659124,1.3358654
"GOLDEN RISE ESTATE, LORONG KISMIS, Singapore",103.7659124,1.3358654
"GOLDEN RISE ESTATE, TOH TUCK WALK, Singapore",103.7659124,1.3358654
"GOLDEN HILL ESTATE, LI HWAN PLACE, Singapore",103.8634664,1.3555855
"GOLDEN HILL ESTATE, LI HWAN DRIVE, Singapore",103.8634664,1.3555855
"GOLDEN HILL ESTATE, LI HWAN TERRACE, Singapore",103.8634664,1.3555855
"GOLDEN HILL ESTATE, MEI HWAN CRESCENT, Singapore",103.8634664,1.3555855
"GOLDEN HILL ESTATE, LI HWAN CLOSE, Singapore",103.8634664,1.3555855
"GOLDEN HILL ESTATE, MEI HWAN DRIVE, Singapore",103.8634664,1.3555855
"GOLDEN HILL ESTATE, LI HWAN VIEW, Singapore",103.8634664,1.3555855
"GOLDEN HILL ESTATE, MEI HWAN ROAD, Singapore",103.8589093,1.35448
"GOLDEN CHUAN VILLE, LORONG CHUAN, Singapore",103.8642972,1.3538878
"GLASGOW GREEN, GLASGOW ROAD, Singapore",103.819836,1.352083
"GEYLANG CONSERVATION AREA, LORONG 24 GEYLANG, Singapore",103.8833326,1.3121773
"GEYLANG CONSERVATION AREA, LORONG 28 GEYLANG, Singapore",103.8855846,1.3121296
"GERALD RESIDENCE, GERALD TERRACE, Singapore",103.8767371,1.38735
"GERALD MUGLISTON ESTATE, GERALD DRIVE, Singapore",103.877431,1.3843843
"GERALD MUGLISTON ESTATE, GERALD CRESCENT, Singapore",103.8763545,1.386605
"GERALD MUGLISTON ESTATE, JALAN KECHUBONG, Singapore",103.8762192,1.3858724
"GERALD GARDENS, GERALD CRESCENT, Singapore",103.8757941,1.3873271
"GENTLE VILLAS, GENTLE DRIVE, Singapore",103.8409008,1.3201378
"GARLICK PARK, SIXTH AVENUE, Singapore",103.7921606,1.3242223
"GARDEN VIEW ESTATE, CONWAY CIRCLE, Singapore",103.8654995,1.3603203
"GAO MING HUA YUAN, SHAMAH TERRACE, Singapore",103.764356,1.3463566
"GAMBIR TERRACE, LORONG GAMBIR, Singapore",103.8759464,1.3448938
"GALLOP VILLAS, GALLOP PARK ROAD, Singapore",103.8119735,1.3186534
"GABRIEL VILLAS, SERANGOON AVENUE 1, Singapore",103.8770009,1.3472244
"FUYONG ESTATE, JALAN ASAS, Singapore",103.768433,1.358096
"FUYONG ESTATE, JALAN TUMPU, Singapore",103.768433,1.358096
"FUYONG ESTATE, JALAN UJI, Singapore",103.768433,1.358096
"FUYONG ESTATE, JALAN SIAP, Singapore",103.768433,1.358096
"FULTON HILL, FULTON ROAD, Singapore",103.819836,1.352083
"FULTON HILL, FULTON AVENUE, Singapore",103.819836,1.352083
"FUDU PARK, LENTOR GROVE, Singapore",103.8381851,1.3900055
"FUDU PARK, LENTOR TERRACE, Singapore",103.8381851,1.3900055
"FUDU PARK, FUDU PARK, Singapore",103.8381851,1.3900055
"FUDU PARK, FUDU WALK, Singapore",103.8381851,1.3900055
"FRANKEL ESTATE, BURNFOOT TERRACE, Singapore",103.9220962,1.3125262
"FRANKEL ESTATE, FRANKEL TERRACE, Singapore",103.917948,1.316494
"FRANKEL ESTATE, SIGLAP WALK, Singapore",103.917948,1.316494
"FRANKEL ESTATE, WILTON GARDENS, Singapore",103.917948,1.316494
"FRANKEL ESTATE, SIGLAP RISE, Singapore",103.917948,1.316494
"FRANKEL ESTATE, SIGLAP DRIVE, Singapore",103.917948,1.316494
"FRANKEL ESTATE, SIGLAP ROAD, Singapore",103.917948,1.316494
"FRANKEL ESTATE, BOWMONT GARDENS, Singapore",103.917948,1.316494
"FRANKEL ESTATE, FRANKEL PLACE, Singapore",103.917948,1.316494
"FRANKEL ESTATE, YARROW GARDENS, Singapore",103.9218985,1.3152788
"FRANKEL ESTATE, ROSEBURN AVENUE, Singapore",103.917948,1.316494
"FRANKEL ESTATE, HARTLEY GROVE, Singapore",103.917948,1.316494
"FRANKEL ESTATE, CHEVIOT HILL, Singapore",103.917948,1.316494
"FRANKEL ESTATE, JEDBURGH GARDENS, Singapore",103.917948,1.316494
"FRANKEL ESTATE, FRANKEL DRIVE, Singapore",103.917948,1.316494
"FRANKEL ESTATE, DUNBAR WALK, Singapore",103.917948,1.316494
"FRANKEL ESTATE, EAST COAST ROAD, Singapore",103.917948,1.316494
"FRANKEL ESTATE, SIGLAP PLAIN, Singapore",103.917948,1.316494
"FRANKEL ESTATE, FRANKEL AVENUE, Singapore",103.917948,1.316494
"FRANKEL ESTATE, CHANGI ROAD, Singapore",103.917948,1.316494
"FRANKEL ESTATE, SIGLAP VIEW, Singapore",103.9177465,1.319398
"FRANKEL ESTATE, COLDSTREAM AVENUE, Singapore",103.9190654,1.3118036
"FRANKEL ESTATE, ETTRICK TERRACE, Singapore",103.9217973,1.3130306
"FRANKEL ESTATE, SIGLAP TERRACE, Singapore",103.917948,1.316494
"FRANKEL ESTATE, LA SALLE STREET, Singapore",103.917948,1.316494
"FRANKEL ESTATE, FRANKEL STREET, Singapore",103.917948,1.316494
"FRANKEL ESTATE, SIGLAP AVENUE, Singapore",103.917948,1.316494
"FRANKEL ESTATE, SIGLAP BANK, Singapore",103.917948,1.316494
"FRANKEL ESTATE, SIGLAP HILL, Singapore",103.917948,1.316494
"FORTUNA HILL, HILLSIDE DRIVE, Singapore",103.8770115,1.359671
"FORTUNA HILL, JANSEN ROAD, Singapore",103.8770115,1.359671
"FORTUNA GARDENS, DA SILVA LANE, Singapore",103.8503404,1.2811866
"FLORISSA PARK, LENTOR LOOP, Singapore",103.8369166,1.3867516
"FLORISSA PARK, FLORISSA PARK, Singapore",103.8353566,1.3869845
"FLORIDA PARK, SUNRISE WAY, Singapore",103.8548807,1.3889248
"FLORIDA PARK, SUNRISE LANE, Singapore",103.8548807,1.3889248
"FLORIDA PARK, SUNRISE AVENUE, Singapore",103.8548807,1.3889248
"FLORIDA PARK, SUNRISE WALK, Singapore",103.8548807,1.3889248
"FLORIDA PARK, SUNRISE DRIVE, Singapore",103.8548807,1.3889248
"FLORENCE TERRACE, FLORENCE ROAD, Singapore",103.8859105,1.3656622
"FLORENCE GROVE, FLORENCE CLOSE, Singapore",103.8859364,1.3623648
"FLORENCE GARDENS, FLORENCE ROAD, Singapore",103.8859105,1.3656622
"FERNWOOD TERRACES, EAST COAST AVENUE, Singapore",103.9242935,1.310215
"FERNWOOD TERRACES, FERNWOOD TERRACE, Singapore",103.9252364,1.3094741
"FENGLI GARDENS, LORONG ONG LYE, Singapore",103.879763,1.3483046
"FARRER GARDENS, QUEEN'S ROAD, Singapore",103.8067765,1.3173411
"FANTA GARDEN, BEGONIA DRIVE, Singapore",103.8642529,1.3878222
"FABER HILLS, FABER DRIVE, Singapore",103.7563561,1.3203983
"FABER HILLS, FABER GREEN, Singapore",103.7563561,1.3203983
"FABER HILLS, FABER TERRACE, Singapore",103.7563561,1.3203983
"FABER HILLS, FABER CRESCENT, Singapore",103.7563561,1.3203983
"FABER HILLS, FABER WALK, Singapore",103.7563561,1.3203983
"FABER HILLS, FABER AVENUE, Singapore",103.7563561,1.3203983
"FABER HILLS, FABER GROVE, Singapore",103.7563561,1.3203983
"FABER HILLS, FABER HEIGHTS, Singapore",103.7563561,1.3203983
"FABER HILLS, FABER PARK, Singapore",103.7563561,1.3203983
"FABER GARDEN, JALAN GENDANG, Singapore",103.8300685,1.3624658
"FABER GARDEN, JALAN REBANA, Singapore",103.8300685,1.3624658
"EXCELSIOR GARDENS, MINARET WALK, Singapore",103.9523202,1.3250112
"EVERGREEN GARDEN, EVERGREEN AVENUE, Singapore",103.9356451,1.3148991
"ENG KONG PARK, ENG KONG PLACE, Singapore",103.7683953,1.3364687
"ENG KONG PARK, ENG KONG CRESCENT, Singapore",103.7683953,1.3364687
"ENG KONG PARK, ENG KONG GARDEN, Singapore",103.7683953,1.3364687
"ENG AUN PARK, JALAN NOVENA, Singapore",103.8421048,1.3237789
"ENG AUN PARK, JALAN NOVENA SELATAN, Singapore",103.8421048,1.3237789
"ENG AUN PARK, JALAN NOVENA UTARA, Singapore",103.8421048,1.3237789
"EMERALD HILL CONSERVATION AREA, EMERALD HILL ROAD, Singapore",103.8392077,1.3019155
"EMERALD HILL CONSERVATION AREA, SAUNDERS ROAD, Singapore",103.8392077,1.3019155
"EMERALD HILL CONSERVATION AREA, CAIRNHILL ROAD, Singapore",103.8392077,1.3019155
"ELITE COURT, ELITE TERRACE, Singapore",103.9249945,1.3162269
"ELIAS TERRACE, ELIAS TERRACE, Singapore",103.9421606,1.3720962
"EDEN PARK, CHERRY AVENUE, Singapore",103.819836,1.352083
"EDEN PARK, REDWOOD AVENUE, Singapore",103.7918968,1.3315786
"EDEN PARK, FIR AVENUE, Singapore",103.7911492,1.3323717
"EDEN PARK, CYPRESS AVENUE, Singapore",103.7914329,1.3311198
"EDEN PARK, MAPLE AVENUE, Singapore",103.819836,1.352083
"EDEN PARK, MAPLE LANE, Singapore",103.7920592,1.329029
"EATON PARK, GERALD DRIVE, Singapore",103.8779115,1.3879656
"EATON PARK, GERALD CRESCENT, Singapore",103.8779115,1.3879656
"EASTWOOD WALK GARDENS, EASTWOOD WALK, Singapore",103.9567508,1.32249
"EASTWOOD VILLE, EASTWOOD TERRACE, Singapore",103.819836,1.352083
"EASTWOOD VILLE, EASTWOOD DRIVE, Singapore",103.819836,1.352083
"EASTWOOD TERRACE, EASTWOOD WALK, Singapore",103.9571367,1.3219938
"EASTWOOD PARK, EASTWOOD PLACE, Singapore",103.9562737,1.3221148
"EASTWOOD PARK, EASTWOOD GREEN, Singapore",103.9561328,1.3228039
"EASTWOOD PARK, EASTWOOD ROAD, Singapore",103.9560475,1.3213954
"EASTWOOD PARK, EASTWOOD DRIVE, Singapore",103.9557363,1.3233243
"EASTWOOD PARK, EASTWOOD WAY, Singapore",103.9575941,1.3231389
"EASTWOOD GREEN TERRACES, EASTWOOD GREEN, Singapore",103.9549171,1.3222832
"EASTWOOD GARDENS, TUA KONG TERRACE, Singapore",103.819836,1.352083
"EASTERN GROVE, JALAN LIMAU KASTURI, Singapore",103.819836,1.352083
"EASTERN GROVE, JALAN LIMAU MANIS, Singapore",103.819836,1.352083
"EASTERN GARDEN, EVERGREEN AVENUE, Singapore",103.819836,1.352083
"EAST VIEW GARDEN, JALAN PERGAM, Singapore",103.9615492,1.3451034
"EAST VIEW GARDEN, UPPER CHANGI ROAD EAST, Singapore",103.9615492,1.3451034
"EAST VIEW GARDEN, MERAGI CLOSE, Singapore",103.9615492,1.3451034
"EAST VIEW GARDEN, JALAN KUANG, Singapore",103.9615492,1.3451034
"EAST COAST PARK, SECOND STREET, Singapore",103.9121866,1.3007842
"EAST COAST PARK, SIGLAP ROAD, Singapore",103.923105,1.313587
"EAST COAST PARK, FIRST STREET, Singapore",103.9121866,1.3007842
"EAST COAST PARK, THIRD STREET, Singapore",103.9121866,1.3007842
"EAST COAST PARK, FOURTH STREET, Singapore",103.9121866,1.3007842
"EAST COAST HILL, SENNETT AVENUE, Singapore",103.819836,1.352083
"EAST COAST HILL, SENNETT LANE, Singapore",103.819836,1.352083
"EAST COAST HILL, SENNETT PLACE, Singapore",103.819836,1.352083
"DUNEARN ESTATE, DUNEARN ROAD, Singapore",103.8090096,1.325467
"DUNEARN ESTATE, TREVOSE CRESCENT, Singapore",103.8225016,1.3266707
"DUNEARN ESTATE, TUDOR CLOSE, Singapore",103.8197132,1.3268756
"DUNEARN ESTATE, BERRIMA ROAD, Singapore",103.8238264,1.3255622
"DUNEARN ESTATE, HARLYN ROAD, Singapore",103.8231535,1.3244305
"DUNEARN ESTATE, DALKEITH ROAD, Singapore",103.822301,1.3241198
"DUKE'S GARDEN, PRINCESS OF WALES ROAD, Singapore",103.819836,1.352083
"DUCHESS GARDEN, DUCHESS AVENUE, Singapore",103.80292,1.32348
"DUCHESS GARDEN, CORONATION ROAD, Singapore",103.819836,1.352083
"DRAGON VIEW PARK, JALAN MUTIARA, Singapore",103.8285574,1.2966417
"DEDAP GARDENS, DEDAP PLACE, Singapore",103.8670981,1.388186
"DEDAP GARDENS, DEDAP LINK, Singapore",103.8670981,1.388186
"DAISY TERRACE, DAISY ROAD, Singapore",103.819836,1.352083
"DAISY PARK, DAISY AVENUE, Singapore",103.8668268,1.3448275
"D'WILKINSON, WILKINSON ROAD, Singapore",103.8908503,1.3026352
"COUNTRYVIEW, SEMBAWANG PLACE, Singapore",103.8247125,1.4387513
"CORONATION WEST PARK, CORONATION ROAD WEST, Singapore",103.7945875,1.3197816
"CORONATION VILLE, CORONATION ROAD, Singapore",103.7945875,1.3197816
"CORONATION VILLAGE, CORONATION ROAD, Singapore",103.8053262,1.3218636
"CORAL PARK, PEMIMPIN PLACE, Singapore",103.8436361,1.3540743
"CORAL PARK, PEMIMPIN TERRACE, Singapore",103.8436361,1.3540743
"CORAL PARK, JALAN PEMIMPIN, Singapore",103.8436361,1.3540743
"CORAL ISLAND, CORAL ISLAND, Singapore",103.819836,1.352083
"COMFORT GARDEN, HONG SAN WALK, Singapore",103.7453292,1.3772507
"COMFORT GARDEN, CHOA CHU KANG AVENUE 1, Singapore",103.7453292,1.3772507
"COASTAL VILLAS, UPPER EAST COAST ROAD, Singapore",103.9410437,1.3149833
"CLYDESCOVE, LOYANG PLACE, Singapore",103.9616016,1.3794783
"CLOVER PARK, CLOVER RISE, Singapore",103.8430619,1.3503373
"CLOVER PARK, CLOVER WAY, Singapore",103.8430619,1.3503373
"CLOVER PARK, JALAN PEMIMPIN, Singapore",103.8430619,1.3503373
"CLOVER PARK, CLOVER CRESCENT, Singapore",103.8430619,1.3503373
"CLOVER PARK, CLOVER CLOSE, Singapore",103.8430619,1.3503373
"CLOVER PARK, CLOVER AVENUE, Singapore",103.8430619,1.3503373
"CLEMENTI PARK, SUNSET WAY, Singapore",103.766708,1.327312
"CLEMENTI PARK, SUNSET VIEW, Singapore",103.766708,1.327312
"CLEMENTI PARK, SUNSET SQUARE, Singapore",103.766708,1.327312
"CLEMENTI GREEN, CLEMENTI CRESCENT, Singapore",103.7729284,1.3231977
"CLASSICAL TERRACE, JALAN RINDU, Singapore",103.8765113,1.3446994
"CHWEE CHIAN VIEW, CHWEE CHIAN VIEW, Singapore",103.788216,1.2798086
"CHUAN VILLE, CHUAN LINK, Singapore",103.8670215,1.360873
"CHUAN VILLAS, CHUAN CLOSE, Singapore",103.8612256,1.349595
"CHUAN TERRACE, CHUAN TERRACE, Singapore",103.8672865,1.3620599
"CHUAN GREEN, CHUAN LINK, Singapore",103.8660641,1.3605106
"CHUAN GREEN, CHUAN PLACE, Singapore",103.8660641,1.3605106
"CHUAN GREEN, CHUAN VIEW, Singapore",103.8660641,1.3605106
"CHUAN GREEN, CHUAN DRIVE, Singapore",103.8660641,1.3605106
"CHUAN GARDEN, LORONG CHUAN, Singapore",103.8678787,1.362093
"CHUAN GARDEN, CHUAN GARDEN, Singapore",103.86897,1.3627037
"CHOON SING GARDEN, JALAN BINCHANG, Singapore",103.8476177,1.3532659
"CHIP THYE GARDEN, YIO CHU KANG GARDENS, Singapore",103.8371534,1.3813772
"CHIP HOCK GARDENS, JALAN HAROM SETANGKAI, Singapore",103.8127162,1.3201048
"CHIP BEE GARDENS, JALAN HITAM MANIS, Singapore",103.7989639,1.308439
"CHIP BEE GARDENS, HOLLAND ROAD, Singapore",103.7974469,1.3132726
"CHESTNUT GARDENS, CHESTNUT GARDENS, Singapore",103.7685616,1.3691931
"CHESTER PARK, LORONG SARHAD, Singapore",103.7882344,1.2807277
"CHEOW KENG GARDEN, CHEOW KENG ROAD, Singapore",103.819836,1.352083
"CHENG SOON GARDEN, CHENG SOON GARDEN, Singapore",103.7720389,1.3345689
"CHENG SOON GARDEN, KISMIS AVENUE, Singapore",103.770741,1.3350316
"CHENG SOON GARDEN, CHENG SOON CRESCENT, Singapore",103.7723376,1.3361781
"CHELSEA VILLAGE, JAMBOL PLACE, Singapore",103.7899286,1.279438
"CHELSEA VILLAGE, JALAN MAT JAMBOL, Singapore",103.7918909,1.2783301
"CHARLTON PARK, SURIN AVENUE, Singapore",103.8859082,1.3557915
"CHARLTON PARK, JALAN LEPAS, Singapore",103.8859082,1.3557915
"CHARLTON PARK, CHARLTON ROAD, Singapore",103.819836,1.352083
"CHARLTON PARK, JALAN GENENG, Singapore",103.8859082,1.3557915
"CHARLTON PARK, JALAN MASTULI, Singapore",103.8859082,1.3557915
"CHARLTON PARK, JALAN PELIKAT, Singapore",103.8859082,1.3557915
"CHARLTON PARK, AROOZOO AVENUE, Singapore",103.8859082,1.3557915
"CHARLTON PARK, TAMAN SIREH, Singapore",103.8859082,1.3557915
"CHARLTON PARK, CHARLTON LANE, Singapore",103.8819989,1.3557472
"CHARLTON PARK, JALAN SONGKET, Singapore",103.8859082,1.3557915
"CHARLTON PARK, VEERAGOO CLOSE, Singapore",103.8859082,1.3557915
"CHARLTON PARK, SURIN LANE, Singapore",103.819836,1.352083
"CHANGI HEIGHTS, JALAN SINAR BINTANG, Singapore",103.9720907,1.3628741
"CHANGI HEIGHTS, JALAN SINAR BULAN, Singapore",103.9720907,1.3628741
"CHANGI GROVE, MARIAM CLOSE, Singapore",103.9689467,1.361452
"CHANGI GROVE, JALAN MARIAM, Singapore",103.9694691,1.3622256
"CHANGI GROVE, LENGKOK MARIAM, Singapore",103.9697957,1.362785
"CENTURY WOODS, WOODGROVE VIEW, Singapore",103.7763238,1.4279327
"CENTURY WOODS, WOODGROVE WALK, Singapore",103.7765768,1.4272305
"CATHAY GARDEN, KERIS DRIVE, Singapore",103.9197436,1.3095824
"CATHAY GARDEN, JALAN KERIS, Singapore",103.9195047,1.3101131
"CASHEW VILLAS, CASHEW CRESCENT, Singapore",103.7694594,1.3714454
"CASHEW ESTATE, CASHEW TERRACE, Singapore",103.7658514,1.3709196
"CASA SERENO, LENGKONG TUJOH, Singapore",103.9146578,1.3288736
"CARMINE COLLECTION, ENG KONG ROAD, Singapore",103.7682078,1.3354247
"CAPITOL PARK, JALAN ASUHAN, Singapore",103.8179921,1.3278531
"CAPITOL PARK, JALAN SENI, Singapore",103.8179921,1.3278531
"CAPITOL PARK, JALAN ILMU, Singapore",103.8179921,1.3278531
"CAPITOL PARK, JALAN ADAT, Singapore",103.8179921,1.3278531
"CAPITOL PARK, UNIVERSITY ROAD, Singapore",103.819836,1.352083
"CAPITOL PARK, JALAN SEJARAH, Singapore",103.8179921,1.3278531
"CAPITOL PARK, JALAN UNGGAS, Singapore",103.8179921,1.3278531
"CAPITOL PARK, DUNEARN CLOSE, Singapore",103.8142542,1.3244219
"CAPITOL PARK, CHEE HOON AVENUE, Singapore",103.8179921,1.3278531
"CANARY PARK, JALAN SIMPANG BEDOK, Singapore",103.9273405,1.3236038
"CAMELIA PARK, TAMARIND ROAD, Singapore",103.819836,1.352083
"CAMDEN PARK, CAMDEN PARK, Singapore",103.819836,1.352083
"CALDECOTT HILL ESTATE, LORNIE ROAD, Singapore",103.8283895,1.3405649
"CALDECOTT HILL ESTATE, CALDECOTT CLOSE, Singapore",103.8310367,1.3384749
"CALDECOTT HILL ESTATE, ANDREW ROAD, Singapore",103.833245,1.3364364
"CALDECOTT HILL ESTATE, OLIVE ROAD, Singapore",103.8350779,1.3375297
"CAIRNHILL CONSERVATION AREA, CAIRNHILL ROAD, Singapore",103.8373289,1.3067162
"CACTUS GREEN, CACTUS CRESCENT, Singapore",103.8525036,1.3918585
"CACTUS BLOOM, CACTUS ROAD, Singapore",103.8514851,1.391046
"BURGUNDY HILL, BURGUNDY CRESCENT, Singapore",103.760437,1.339154
"BURGUNDY HILL, BURGUNDY DRIVE, Singapore",103.760437,1.339154
"BURGUNDY HILL, BURGUNDY RISE, Singapore",103.760437,1.339154
"BUKIT LOYANG ESTATE, JALAN KELEMPONG, Singapore",103.9674548,1.3622742
"BUKIT LOYANG ESTATE, JALAN BATALONG EAST, Singapore",103.9681817,1.3621684
"BUKIT LOYANG ESTATE, JALAN BATALONG, Singapore",103.9642868,1.3606832
"BUKIT LOYANG ESTATE, JALAN CHELAGI, Singapore",103.9652072,1.3614428
"BRIGHT GARDEN, LORONG L TELOK KURAU, Singapore",103.9118591,1.3119655
"BREEZEWAYS, JALAN MAT JAMBOL, Singapore",103.7918909,1.2783301
"BRADDELL HEIGHTS ESTATE, MACKERROW ROAD, Singapore",103.8645012,1.3480766
"BRADDELL HEIGHTS ESTATE, LYNWOOD GROVE, Singapore",103.8645012,1.3480766
"BRADDELL HEIGHTS ESTATE, SERANGOON AVENUE 3, Singapore",103.8645012,1.3480766
"BRADDELL HEIGHTS ESTATE, MELROSE DRIVE, Singapore",103.8645012,1.3480766
"BRADDELL HEIGHTS ESTATE, DUNSFOLD DRIVE, Singapore",103.8645012,1.3480766
"BRADDELL HEIGHTS ESTATE, MUSWELL HILL, Singapore",103.8645012,1.3480766
"BRADDELL HEIGHTS ESTATE, MATLOCK RISE, Singapore",103.8645012,1.3480766
"BRADDELL HEIGHTS ESTATE, COTSWOLD CLOSE, Singapore",103.8645012,1.3480766
"BRADDELL HEIGHTS ESTATE, CLIFTON VALE, Singapore",103.8645012,1.3480766
"BRADDELL HEIGHTS ESTATE, CHILTERN DRIVE, Singapore",103.8645012,1.3480766
"BRADDELL HEIGHTS ESTATE, SUNDRIDGE PARK ROAD, Singapore",103.8645012,1.3480766
"BLAIR PLAIN CONSERVATION AREA, SPOTTISWOODE PARK ROAD, Singapore",103.8363264,1.2762933
"BLAIR PLAIN CONSERVATION AREA, NEIL ROAD, Singapore",103.8363264,1.2762933
"BLAIR PLAIN CONSERVATION AREA, BLAIR ROAD, Singapore",103.8363264,1.2762933
"BLAIR PLAIN CONSERVATION AREA, EVERTON ROAD, Singapore",103.8363264,1.2762933
"BINJAI PARK, BINJAI PARK, Singapore",103.7877738,1.3391323
"BENA PARK, JALAN PERNAMA, Singapore",103.969481,1.3531732
"BENA PARK, JALAN BENA, Singapore",103.969481,1.3531732
"BELGRAVIA PARK, SELETAR TERRACE, Singapore",103.819836,1.352083
"BEECHWOOD TERRACE, BEECHWOOD GROVE, Singapore",103.7779328,1.4267128
"BEDOKVILLE, JALAN LIMAU PURUT, Singapore",103.9477789,1.3233262
"BEDOKVILLE, JALAN LIMAU MANIS, Singapore",103.9477558,1.3239882
"BEDOKVILLE, JALAN LIMAU NIPIS, Singapore",103.9479966,1.3247578
"BEDOK RIA, BEDOK RIA PLACE, Singapore",103.951376,1.3272885
"BEDOK RIA, JALAN NIPAH, Singapore",103.9534618,1.3264972
"BEDOK RIA, BEDOK RIA CRESCENT, Singapore",103.9520473,1.327416
"BEDOK RIA, BEDOK RIA TERRACE, Singapore",103.9542885,1.3256588
"BEDOK PESARI, JALAN GREJA, Singapore",103.9550755,1.3237034
"BEDOK PARK, LIMAU GARDEN, Singapore",103.9504834,1.3221623
"BEDOK GROVE, BEDOK PLACE, Singapore",103.9535732,1.3253611
