Address,lon,lat
"LANDED HOUSING DEVELOPMENT, JALAN WANGI, Singapore",103.8746844,1.3305292
"LANDED HOUSING DEVELOPMENT, LORONG LEW LIAN, Singapore",103.8772944,1.3500706
"LANDED HOUSING DEVELOPMENT, WESTERHOUT ROAD, Singapore",103.8806582,1.3110221
"LANDED HOUSING DEVELOPMENT, JALAN PACHELI, Singapore",103.8628072,1.3559844
"LANDED HOUSING DEVELOPMENT, PAYA LEBAR PLACE, Singapore",103.8814785,1.3493361
"LANDED HOUSING DEVELOPMENT, JALAN TERUBOK, Singapore",103.835469,1.3546411
"LANDED HOUSING DEVELOPMENT, JALAN TANI, Singapore",103.884883,1.3668101
"LANDED HOUSING DEVELOPMENT, LORONG PISANG RAJA, Singapore",103.7727867,1.3430639
"LANDED HOUSING DEVELOPMENT, JALAN LAPANG, Singapore",103.9165664,1.3228533
"LANDED HOUSING DEVELOPMENT, NALLUR ROAD, Singapore",103.9321836,1.3123104
"LANDED HOUSING DEVELOPMENT, JALAN LYE KWEE, Singapore",103.8979706,1.3709806
"LANDED HOUSING DEVELOPMENT, JOON HIANG ROAD, Singapore",103.8750824,1.353078
"LANDED HOUSING DEVELOPMENT, ELITE PARK AVENUE, Singapore",103.9242988,1.3150496
"LANDED HOUSING DEVELOPMENT, LORONG H TELOK KURAU, Singapore",103.9107491,1.3162713
"LANDED HOUSING DEVELOPMENT, BRIGHTON CRESCENT, Singapore",103.8704052,1.3621374
"LANDED HOUSING DEVELOPMENT, LORONG 106 CHANGI, Singapore",103.9033481,1.3165934
"LANDED HOUSING DEVELOPMENT, JALAN LEPAS, Singapore",103.888052,1.356038
"LANDED HOUSING DEVELOPMENT, LORONG 101 CHANGI, Singapore",103.8998245,1.315309
"LANDED HOUSING DEVELOPMENT, JALAN MASTULI, Singapore",103.8855073,1.3549803
"LANDED HOUSING DEVELOPMENT, PAYA LEBAR STREET, Singapore",103.8855198,1.3389943
"LANDED HOUSING DEVELOPMENT, YUK TONG AVENUE, Singapore",103.7728162,1.3447663
"LANDED HOUSING DEVELOPMENT, ST. HELIER'S AVENUE, Singapore",103.8714987,1.3614599
"LANDED HOUSING DEVELOPMENT, KOVAN ROAD, Singapore",103.8811158,1.3583937
"LANDED HOUSING DEVELOPMENT, LORONG 34 GEYLANG, Singapore",103.8878678,1.3129517
"LANDED HOUSING DEVELOPMENT, JALAN CHERMAT, Singapore",103.8783214,1.3516662
"LANDED HOUSING DEVELOPMENT, TELOK KURAU ROAD, Singapore",103.9108615,1.3122916
"LANDED HOUSING DEVELOPMENT, CRANE ROAD, Singapore",103.8987855,1.3123435
"LANDED HOUSING DEVELOPMENT, LORONG CHUAN, Singapore",103.8642972,1.3538878
"LANDED HOUSING DEVELOPMENT, JALAN DERMAWAN, Singapore",103.7596777,1.3600969
"LANDED HOUSING DEVELOPMENT, LORONG 1 REALTY PARK, Singapore",103.8902077,1.367396
"LANDED HOUSING DEVELOPMENT, PASIR PANJANG ROAD, Singapore",103.7845139,1.2811403
"LANDED HOUSING DEVELOPMENT, HAI SING ROAD, Singapore",103.8934211,1.3657267
"LANDED HOUSING DEVELOPMENT, JOO CHIAT AVENUE, Singapore",103.9116366,1.3159035
"LANDED HOUSING DEVELOPMENT, JOO CHIAT PLACE, Singapore",103.9074128,1.3144595
"LANDED HOUSING DEVELOPMENT, ELITE TERRACE, Singapore",103.9249945,1.3162269
"LANDED HOUSING DEVELOPMENT, LORONG 14 GEYLANG, Singapore",103.8791603,1.311298
"LANDED HOUSING DEVELOPMENT, STARLIGHT ROAD, Singapore",103.8535881,1.3139464
"LANDED HOUSING DEVELOPMENT, JALAN YASIN, Singapore",103.9063193,1.320488
"LANDED HOUSING DEVELOPMENT, LORONG M TELOK KURAU, Singapore",103.9124768,1.3109464
"LANDED HOUSING DEVELOPMENT, JALAN CHENGKEK, Singapore",103.8844268,1.3301635
"LANDED HOUSING DEVELOPMENT, CRANBORNE ROAD, Singapore",103.8872304,1.3052067
"LANDED HOUSING DEVELOPMENT, GARLICK AVENUE, Singapore",103.7912092,1.3285949
"LANDED HOUSING DEVELOPMENT, KOON SENG ROAD, Singapore",103.9042873,1.3115593
"LANDED HOUSING DEVELOPMENT, LORONG 21 GEYLANG, Singapore",103.8800085,1.3143207
"LANDED HOUSING DEVELOPMENT, MARSHALL ROAD, Singapore",103.900925,1.3071074
"LANDED HOUSING DEVELOPMENT, PARBURY AVENUE, Singapore",103.9429496,1.3176655
"LANDED HOUSING DEVELOPMENT, JALAN KORBAN, Singapore",103.8837265,1.3445814
"LANDED HOUSING DEVELOPMENT, EVERITT ROAD NORTH, Singapore",103.9016072,1.315545
"LANDED HOUSING DEVELOPMENT, BEDOK WALK, Singapore",103.9470657,1.3306126
"LANDED HOUSING DEVELOPMENT, LORONG TANGGAM, Singapore",103.8739081,1.3973442
"LANDED HOUSING DEVELOPMENT, BEDOK TERRACE, Singapore",103.9479961,1.325398
"LANDED HOUSING DEVELOPMENT, JALAN ANAK PATONG, Singapore",103.9441325,1.3314212
"LANDED HOUSING DEVELOPMENT, CHIAP GUAN AVENUE, Singapore",103.8758364,1.361088
"LANDED HOUSING DEVELOPMENT, TAMAN BEDOK, Singapore",103.954123,1.3246893
"LANDED HOUSING DEVELOPMENT, UPPER THOMSON ROAD, Singapore",103.8285173,1.3725206
"LANDED HOUSING DEVELOPMENT, JALAN KEMAMAN, Singapore",103.8504964,1.3265704
"LANDED HOUSING DEVELOPMENT, SIMON WALK, Singapore",103.8851047,1.3625828
"LANDED HOUSING DEVELOPMENT, JALAN ANGIN LAUT, Singapore",103.955066,1.3369845
"LANDED HOUSING DEVELOPMENT, LORONG L TELOK KURAU, Singapore",103.9118591,1.3119655
"LANDED HOUSING DEVELOPMENT, JALAN SENANG, Singapore",103.9162698,1.3251828
"LANDED HOUSING DEVELOPMENT, AH SOO WALK, Singapore",103.8840613,1.3509634
"LANDED HOUSING DEVELOPMENT, LORONG 30 GEYLANG, Singapore",103.8863208,1.3125459
"LANDED HOUSING DEVELOPMENT, LORONG 20 GEYLANG, Singapore",103.881329,1.3113934
"LANDED HOUSING DEVELOPMENT, JALAN SEMPADAN, Singapore",103.9273085,1.3124342
"LANDED HOUSING DEVELOPMENT, BEDOK GARDEN, Singapore",103.9529378,1.3230174
"LANDED HOUSING DEVELOPMENT, LORONG 6 REALTY PARK, Singapore",103.888798,1.368635
"LANDED HOUSING DEVELOPMENT, SIMON PLACE, Singapore",103.883775,1.3648116
"LANDED HOUSING DEVELOPMENT, EAST COAST ROAD, Singapore",103.9149972,1.3085237
"LANDED HOUSING DEVELOPMENT, RECREATION ROAD, Singapore",103.8747708,1.3524216
"LANDED HOUSING DEVELOPMENT, TEOW HOCK AVENUE, Singapore",103.8795631,1.3623938
"LANDED HOUSING DEVELOPMENT, JALAN ISHAK, Singapore",103.9078138,1.3250147
"LANDED HOUSING DEVELOPMENT, JALAN TARI DULANG, Singapore",103.8703845,1.4000298
"LANDED HOUSING DEVELOPMENT, LUCKY GARDENS, Singapore",103.940924,1.3193166
"LANDED HOUSING DEVELOPMENT, TAMPINES ROAD, Singapore",103.9105376,1.3698249
"LANDED HOUSING DEVELOPMENT, CLOVER AVENUE, Singapore",103.8439636,1.3508011
"LANDED HOUSING DEVELOPMENT, EVERGREEN GARDENS, Singapore",103.9345553,1.3151372
"LANDED HOUSING DEVELOPMENT, JALAN GELAM, Singapore",103.8372032,1.4579342
"LANDED HOUSING DEVELOPMENT, LORONG MYDIN, Singapore",103.911268,1.3212356
"LANDED HOUSING DEVELOPMENT, EATON PLACE, Singapore",103.8776681,1.3585632
"LANDED HOUSING DEVELOPMENT, JALAN HOCK CHYE, Singapore",103.8903084,1.3593792
"LANDED HOUSING DEVELOPMENT, SOO CHOW DRIVE, Singapore",103.8314985,1.3536368
"LANDED HOUSING DEVELOPMENT, MANGIS ROAD, Singapore",103.9035765,1.3138019
"LANDED HOUSING DEVELOPMENT, JALAN BENA, Singapore",103.9690473,1.3542081
"LANDED HOUSING DEVELOPMENT, TOH TUCK ROAD, Singapore",103.7661564,1.3397261
"LANDED HOUSING DEVELOPMENT, GUOK AVENUE, Singapore",103.7729962,1.2915916
"LANDED HOUSING DEVELOPMENT, STILL ROAD, Singapore",103.9069852,1.3128404
"LANDED HOUSING DEVELOPMENT, JALAN MANIS, Singapore",103.8633699,1.3257381
"LANDED HOUSING DEVELOPMENT, JALAN RAYA, Singapore",103.8831132,1.3284855
"LANDED HOUSING DEVELOPMENT, LIM TUA TOW ROAD, Singapore",103.8763023,1.3545828
"LANDED HOUSING DEVELOPMENT, LENGKONG TIGA, Singapore",103.91147,1.3243821
"LANDED HOUSING DEVELOPMENT, LIMAU GROVE, Singapore",103.9514753,1.3226872
"LANDED HOUSING DEVELOPMENT, STILL ROAD SOUTH, Singapore",103.909967,1.3054206
"LANDED HOUSING DEVELOPMENT, SOO CHOW VIEW, Singapore",103.8303861,1.3530022
"LANDED HOUSING DEVELOPMENT, LORONG 40 GEYLANG, Singapore",103.8898371,1.3134114
"LANDED HOUSING DEVELOPMENT, HAPPY AVENUE EAST, Singapore",103.8813564,1.3300721
"LANDED HOUSING DEVELOPMENT, SALAM WALK, Singapore",103.9509529,1.3218118
"LANDED HOUSING DEVELOPMENT, JOO CHIAT TERRACE, Singapore",103.902822,1.314799
"LANDED HOUSING DEVELOPMENT, ST. ANNE'S WOOD, Singapore",103.903146,1.3914304
"LANDED HOUSING DEVELOPMENT, TENG TONG ROAD, Singapore",103.904886,1.3106466
"LANDED HOUSING DEVELOPMENT, BEDOK PLACE, Singapore",103.953595,1.325597
"LANDED HOUSING DEVELOPMENT, MENG SUAN ROAD, Singapore",103.8145129,1.4031597
"LANDED HOUSING DEVELOPMENT, SENNETT DRIVE, Singapore",103.9388922,1.3181851
"LANDED HOUSING DEVELOPMENT, JALAN CHORAK, Singapore",103.8813854,1.3605979
"LANDED HOUSING DEVELOPMENT, JALAN ARIF, Singapore",103.8834044,1.3673583
"LANDED HOUSING DEVELOPMENT, LORONG HOW SUN, Singapore",103.8803324,1.3445536
"LANDED HOUSING DEVELOPMENT, JALAN KESOMA, Singapore",103.8785189,1.3464873
"LANDED HOUSING DEVELOPMENT, LORONG MARZUKI, Singapore",103.9089218,1.3224195
"LANDED HOUSING DEVELOPMENT, JOO HONG ROAD, Singapore",103.8873402,1.3639765
"LANDED HOUSING DEVELOPMENT, THIRD STREET, Singapore",103.819836,1.352083
"LANDED HOUSING DEVELOPMENT, PROME ROAD, Singapore",103.8492411,1.3249553
"LANDED HOUSING DEVELOPMENT, JALAN SAHABAT, Singapore",103.879544,1.358028
"LANDED HOUSING DEVELOPMENT, SENNETT TERRACE, Singapore",103.9397218,1.3197577
"LANDED HOUSING DEVELOPMENT, CHUAN PLACE, Singapore",103.8678562,1.3605016
"LANDED HOUSING DEVELOPMENT, JOO CHIAT WALK, Singapore",103.9132731,1.3151917
"LANDED HOUSING DEVELOPMENT, LORONG BIAWAK, Singapore",103.8700739,1.3481468
"LANDED HOUSING DEVELOPMENT, LORONG AH SOO, Singapore",103.8848211,1.3514894
"LANDED HOUSING DEVELOPMENT, EE TEOW LENG ROAD, Singapore",103.8781289,1.3580182
"LANDED HOUSING DEVELOPMENT, SERAYA ROAD, Singapore",103.9003082,1.305816
"LANDED HOUSING DEVELOPMENT, JALAN LABU AYER, Singapore",103.8740258,1.3450923
"LANDED HOUSING DEVELOPMENT, LORONG 105 CHANGI, Singapore",103.9026964,1.3164609
"LANDED HOUSING DEVELOPMENT, LORONG STANGEE, Singapore",103.9070053,1.3087448
"LANDED HOUSING DEVELOPMENT, JALAN TAMAN, Singapore",103.864795,1.3260412
"LANDED HOUSING DEVELOPMENT, FABER CRESCENT, Singapore",103.7575469,1.3185908
"LANDED HOUSING DEVELOPMENT, LOWLAND ROAD, Singapore",103.8832573,1.361151
"LANDED HOUSING DEVELOPMENT, FLOWER ROAD, Singapore",103.8813027,1.360207
"LANDED HOUSING DEVELOPMENT, JALAN KRIAN, Singapore",103.9157679,1.3241777
"LANDED HOUSING DEVELOPMENT, JALAN MAHIR, Singapore",103.8841097,1.3448709
"LANDED HOUSING DEVELOPMENT, LORONG 10 GEYLANG, Singapore",103.8775531,1.3119896
"LANDED HOUSING DEVELOPMENT, LORONG 108 CHANGI, Singapore",103.904547,1.3167547
"LANDED HOUSING DEVELOPMENT, SOO CHOW RISE, Singapore",103.8308094,1.353435
"LANDED HOUSING DEVELOPMENT, HENDRY CLOSE, Singapore",103.8812993,1.359558
"LANDED HOUSING DEVELOPMENT, LORONG 107 CHANGI, Singapore",103.9040002,1.3163531
"LANDED HOUSING DEVELOPMENT, SUNRISE PLACE, Singapore",103.8564493,1.3866526
"LANDED HOUSING DEVELOPMENT, AH SOO GARDEN, Singapore",103.8835159,1.350211
"LANDED HOUSING DEVELOPMENT, GERALD PARK, Singapore",103.8780756,1.3877429
"LANDED HOUSING DEVELOPMENT, GRACE WALK, Singapore",103.8690402,1.3582867
"LANDED HOUSING DEVELOPMENT, LILAC ROAD, Singapore",103.8621443,1.3818535
"LANDED HOUSING DEVELOPMENT, DEDAP ROAD, Singapore",103.8653032,1.3882563
"LANDED HOUSING DEVELOPMENT, JALAN PARI KIKIS, Singapore",103.9428174,1.331775
"LANDED HOUSING DEVELOPMENT, CHEMPAKA AVENUE, Singapore",103.8769757,1.3319905
"LANDED HOUSING DEVELOPMENT, DAISY ROAD, Singapore",103.8676629,1.3440551
"LANDED HOUSING DEVELOPMENT, CHARLTON ROAD, Singapore",103.8817505,1.3549226
"LANDED HOUSING DEVELOPMENT, BEDOK CLOSE, Singapore",103.9496777,1.326232
"LANDED HOUSING DEVELOPMENT, JALAN SELAMAT, Singapore",103.9154978,1.3250099
"LANDED HOUSING DEVELOPMENT, LORONG PISANG EMAS, Singapore",103.771555,1.3438276
"LANDED HOUSING DEVELOPMENT, JALAN SENTOSA, Singapore",103.9173352,1.3229507
"LANDED HOUSING DEVELOPMENT, EASTWOOD WAY, Singapore",103.9573486,1.3229611
"LANDED HOUSING DEVELOPMENT, SIMS VIEW, Singapore",103.9109323,1.3200897
"LANDED HOUSING DEVELOPMENT, DUKU LANE, Singapore",103.9068991,1.3098494
"LANDED HOUSING DEVELOPMENT, SWANAGE ROAD, Singapore",103.8939556,1.3088878
"LANDED HOUSING DEVELOPMENT, JANSEN ROAD, Singapore",103.8769565,1.3598878
"LANDED HOUSING DEVELOPMENT, NIVEN ROAD, Singapore",103.8496232,1.3036774
"LANDED HOUSING DEVELOPMENT, JALAN BUNGA RAMPAI, Singapore",103.8834315,1.3397089
"LANDED HOUSING DEVELOPMENT, LICHI AVENUE, Singapore",103.8765729,1.3331937
"LANDED HOUSING DEVELOPMENT, AROOZOO AVENUE, Singapore",103.8853101,1.3553652
"LANDED HOUSING DEVELOPMENT, PUAY HEE AVENUE, Singapore",103.8711799,1.3316698
"LANDED HOUSING DEVELOPMENT, JALAN KAYU, Singapore",103.8730804,1.3965161
"LANDED HOUSING DEVELOPMENT, JALAN DAUD, Singapore",103.9083537,1.3258823
"LANDED HOUSING DEVELOPMENT, JALAN HAJI ALIAS, Singapore",103.7945601,1.3233126
"LANDED HOUSING DEVELOPMENT, DUKU PLACE, Singapore",103.9059124,1.3096723
"LANDED HOUSING DEVELOPMENT, JALAN ISMAIL, Singapore",103.9069745,1.3230526
"LANDED HOUSING DEVELOPMENT, JALAN REMAJA, Singapore",103.7600973,1.3582854
"LANDED HOUSING DEVELOPMENT, KEW TERRACE, Singapore",103.9491081,1.3202655
"LANDED HOUSING DEVELOPMENT, JALAN PELATOK, Singapore",103.9612868,1.3461305
"LANDED HOUSING DEVELOPMENT, TANAH MERAH BESAR ROAD, Singapore",103.9750472,1.3604188
"LANDED HOUSING DEVELOPMENT, PARRY AVENUE, Singapore",103.8792598,1.3643164
"LANDED HOUSING DEVELOPMENT, PHILLIPS AVENUE, Singapore",103.8770577,1.3635947
"LANDED HOUSING DEVELOPMENT, MARIAM CLOSE, Singapore",103.9689467,1.361452
"LANDED HOUSING DEVELOPMENT, HIGHLAND TERRACE, Singapore",103.8797442,1.3587273
"LANDED HOUSING DEVELOPMENT, MOUNT ROSIE ROAD, Singapore",103.8352708,1.3228805
"LANDED HOUSING DEVELOPMENT, LORONG SIGLAP, Singapore",103.9237548,1.3155025
"LANDED HOUSING DEVELOPMENT, ST. FRANCIS ROAD, Singapore",103.8636843,1.3247524
"LANDED HOUSING DEVELOPMENT, BEECHWOOD GROVE, Singapore",103.7779373,1.4270898
"LANDED HOUSING DEVELOPMENT, LORONG G TELOK KURAU, Singapore",103.9101586,1.3171163
"LANDED HOUSING DEVELOPMENT, GAMBIR WALK, Singapore",103.8747022,1.3443455
"LANDED HOUSING DEVELOPMENT, DIX ROAD, Singapore",103.8762561,1.3606171
"LANDED HOUSING DEVELOPMENT, JALAN GUMILANG, Singapore",103.7604051,1.3589472
"LANDED HOUSING DEVELOPMENT, JALAN GRISEK, Singapore",103.9179367,1.324459
"LANDED HOUSING DEVELOPMENT, CHESTNUT LANE, Singapore",103.7681426,1.3673437
"LANDED HOUSING DEVELOPMENT, PASIR PANJANG DRIVE, Singapore",103.7715126,1.2916102
"LANDED HOUSING DEVELOPMENT, JALAN LIMBOK, Singapore",103.8752009,1.3651394
"LANDED HOUSING DEVELOPMENT, DUKE'S ROAD, Singapore",103.8113517,1.3219052
"LANDED HOUSING DEVELOPMENT, LEITH ROAD, Singapore",103.8750412,1.3619278
"LANDED HOUSING DEVELOPMENT, TOH TUCK CLOSE, Singapore",103.7663866,1.3385878
"LANDED HOUSING DEVELOPMENT, LENGKONG SATU, Singapore",103.9129864,1.32655
"LANDED HOUSING DEVELOPMENT, JALAN LATEH, Singapore",103.8696628,1.3460214
"LANDED HOUSING DEVELOPMENT, KANG CHOO BIN ROAD, Singapore",103.8820133,1.3655433
"LANDED HOUSING DEVELOPMENT, MUGLISTON ROAD, Singapore",103.9009462,1.3045861
"LANDED HOUSING DEVELOPMENT, JALAN HAJI SALAM, Singapore",103.9529535,1.3205803
"LANDED HOUSING DEVELOPMENT, CHU LIN ROAD, Singapore",103.7587967,1.3577767
"LANDED HOUSING DEVELOPMENT, MAKEPEACE ROAD, Singapore",103.8424909,1.3123764
"LANDED HOUSING DEVELOPMENT, JALAN INTAN, Singapore",103.7617043,1.3596566
"LANDED HOUSING DEVELOPMENT, RICHARDS AVENUE, Singapore",103.8816341,1.3619822
"LANDED HOUSING DEVELOPMENT, FABER TERRACE, Singapore",103.7562627,1.3211169
"LANDED HOUSING DEVELOPMENT, SANDILANDS ROAD, Singapore",103.8782736,1.3626116
"LANDED HOUSING DEVELOPMENT, JALAN LENGKOK SEMBAWANG, Singapore",103.8258792,1.4286711
"LANDED HOUSING DEVELOPMENT, JALAN KECHOT, Singapore",103.9068222,1.321949
"LANDED HOUSING DEVELOPMENT, CHWEE CHIAN ROAD, Singapore",103.7891501,1.2791956
"LANDED HOUSING DEVELOPMENT, JALAN BAIDURI, Singapore",103.912685,1.3115093
"LANDED HOUSING DEVELOPMENT, CAMBRIDGE ROAD, Singapore",103.8485505,1.3149686
"LANDED HOUSING DEVELOPMENT, WOODGROVE AVENUE, Singapore",103.780696,1.4276723
"LANDED HOUSING DEVELOPMENT, CHANGI ROAD, Singapore",103.9085841,1.3182725
"LANDED HOUSING DEVELOPMENT, MARLENE AVENUE, Singapore",103.8710748,1.3607252
"LANDED HOUSING DEVELOPMENT, PALM DRIVE, Singapore",103.9300531,1.3144842
"LANDED HOUSING DEVELOPMENT, TAMAN SIREH, Singapore",103.8792968,1.3533387
"LANDED HOUSING DEVELOPMENT, JALAN KATHI, Singapore",103.9522998,1.3233653
"LANDED HOUSING DEVELOPMENT, CLOVER WAY, Singapore",103.8448164,1.3499938
"LANDED HOUSING DEVELOPMENT, JALAN GENDANG, Singapore",103.8291987,1.3633821
"LANDED HOUSING DEVELOPMENT, LORONG GAMBIR, Singapore",103.8755509,1.3455826
"LANDED HOUSING DEVELOPMENT, WOLSKEL ROAD, Singapore",103.8690452,1.3471355
"LANDED HOUSING DEVELOPMENT, LORONG N TELOK KURAU, Singapore",103.9127368,1.3100374
"LANDED HOUSING DEVELOPMENT, LORONG MARICAN, Singapore",103.908395,1.3221361
"LANDED HOUSING DEVELOPMENT, PEGU ROAD, Singapore",103.8515999,1.3233951
"LANDED HOUSING DEVELOPMENT, TOH TUCK TERRACE, Singapore",103.7687421,1.3387385
"LANDED HOUSING DEVELOPMENT, MARTIA ROAD, Singapore",103.9106805,1.3076003
"LANDED HOUSING DEVELOPMENT, LANGE ROAD, Singapore",103.8767903,1.3586382
"LANDED HOUSING DEVELOPMENT, JALAN RIMAU, Singapore",103.9072345,1.3291477
"LANDED HOUSING DEVELOPMENT, LORONG NANGKA, Singapore",103.907156,1.3121539
"LANDED HOUSING DEVELOPMENT, LENGKONG DUA, Singapore",103.9120939,1.3258695
"LANDED HOUSING DEVELOPMENT, GERALD DRIVE, Singapore",103.877431,1.3843843
"LANDED HOUSING DEVELOPMENT, VALLEY ROAD, Singapore",103.888423,1.3617648
"LANDED HOUSING DEVELOPMENT, JALAN LIMAU PURUT, Singapore",103.9477789,1.3233262
"LANDED HOUSING DEVELOPMENT, JALAN TAMBAN, Singapore",103.9110501,1.3081982
"LANDED HOUSING DEVELOPMENT, HAI SING CRESCENT, Singapore",103.8936825,1.3647934
"LANDED HOUSING DEVELOPMENT, HAPPY AVENUE NORTH, Singapore",103.8810144,1.3310617
"LANDED HOUSING DEVELOPMENT, ROSE LANE, Singapore",103.8935438,1.3099219
"LANDED HOUSING DEVELOPMENT, BEDOK AVENUE, Singapore",103.9528608,1.3215869
"LANDED HOUSING DEVELOPMENT, MOUNT SINAI DRIVE, Singapore",103.7804475,1.3175596
"LANDED HOUSING DEVELOPMENT, PASIR PANJANG HILL, Singapore",103.7854718,1.2814764
"LANDED HOUSING DEVELOPMENT, FOWLIE ROAD, Singapore",103.9027949,1.3066601
"LANDED HOUSING DEVELOPMENT, JALAN BELANGKAS, Singapore",103.8836208,1.3305516
"LANDED HOUSING DEVELOPMENT, JALAN MAWAR, Singapore",103.882873,1.3314759
"LANDED HOUSING DEVELOPMENT, SPRINGLEAF ROAD, Singapore",103.8222176,1.3974413
"LANDED HOUSING DEVELOPMENT, SIGLAP ROAD, Singapore",103.923105,1.313587
"LANDED HOUSING DEVELOPMENT, LORONG SALLEH, Singapore",103.906866,1.3236672
"LANDED HOUSING DEVELOPMENT, BRADDELL ROAD, Singapore",103.8545674,1.3434257
"LANDED HOUSING DEVELOPMENT, CARLISLE ROAD, Singapore",103.8480691,1.314383
"LANDED HOUSING DEVELOPMENT, STILL LANE, Singapore",103.9086172,1.3107304
"LANDED HOUSING DEVELOPMENT, JALAN SEGAM, Singapore",103.960155,1.3476759
"LANDED HOUSING DEVELOPMENT, HARVEY CLOSE, Singapore",103.9536265,1.3409247
"LANDED HOUSING DEVELOPMENT, CHANCERY HILL WALK, Singapore",103.8394412,1.3235172
"LANDED HOUSING DEVELOPMENT, CHEOW KENG ROAD, Singapore",103.9057912,1.307346
"LANDED HOUSING DEVELOPMENT, JALAN GREJA, Singapore",103.9550755,1.3237034
"LANDED HOUSING DEVELOPMENT, WESTRIDGE WALK, Singapore",103.7902098,1.2775462
"LANDED HOUSING DEVELOPMENT, PRIMROSE AVENUE, Singapore",103.9345991,1.3158098
"LANDED HOUSING DEVELOPMENT, LENGKONG LIMA, Singapore",103.9136156,1.3274238
"LANDED HOUSING DEVELOPMENT, LEITH PARK, Singapore",103.8741237,1.3620971
"LANDED HOUSING DEVELOPMENT, JALAN PUNAI, Singapore",103.9075853,1.329746
"LANDED HOUSING DEVELOPMENT, WOODSVILLE CLOSE, Singapore",103.8679596,1.3296926
"LANDED HOUSING DEVELOPMENT, MOONSTONE LANE, Singapore",103.865865,1.3277592
"LANDED HOUSING DEVELOPMENT, HARVEY CRESCENT, Singapore",103.9543644,1.3406011
"LANDED HOUSING DEVELOPMENT, HAIG AVENUE, Singapore",103.8993562,1.3079541
"LANDED HOUSING DEVELOPMENT, LUCKY RISE, Singapore",103.9407607,1.3186465
"LANDED HOUSING DEVELOPMENT, SOMMERVILLE WALK, Singapore",103.8699947,1.3444279
"LANDED HOUSING DEVELOPMENT, MOONBEAM WALK, Singapore",103.7815344,1.3187792
"LANDED HOUSING DEVELOPMENT, SALLIM ROAD, Singapore",103.8813703,1.3262365
"LANDED HOUSING DEVELOPMENT, JALAN POKOK SERUNAI, Singapore",103.9364623,1.3139486
"LANDED HOUSING DEVELOPMENT, ANGSANA AVENUE, Singapore",103.8743883,1.3316927
"LANDED HOUSING DEVELOPMENT, JALAN PARI BURONG, Singapore",103.9462887,1.3343063
"LANDED HOUSING DEVELOPMENT, JALAN RIA, Singapore",103.8667068,1.3461154
"LANDED HOUSING DEVELOPMENT, JALAN KAYU MANIS, Singapore",103.8349646,1.3047612
"LANDED HOUSING DEVELOPMENT, SHREWSBURY ROAD, Singapore",103.8485812,1.3183048
"LANDED HOUSING DEVELOPMENT, JALAN LOYANG BESAR, Singapore",103.9606109,1.3785756
"LANDED HOUSING DEVELOPMENT, LORONG 102 CHANGI, Singapore",103.9009223,1.3157796
"LANDED HOUSING DEVELOPMENT, SEA AVENUE, Singapore",103.9069785,1.3056865
"LANDED HOUSING DEVELOPMENT, LORONG SARHAD, Singapore",103.7882344,1.2807277
"LANDED HOUSING DEVELOPMENT, SIOK WAN CLOSE, Singapore",103.7892946,1.2780071
"LANDED HOUSING DEVELOPMENT, JALAN SONGKET, Singapore",103.8864443,1.3566713
"LANDED HOUSING DEVELOPMENT, NAMLY DRIVE, Singapore",103.796665,1.3238401
"LANDED HOUSING DEVELOPMENT, TOH AVENUE, Singapore",103.9740608,1.36508
"LANDED HOUSING DEVELOPMENT, TOH DRIVE, Singapore",103.973161,1.3642011
"LANDED HOUSING DEVELOPMENT, LORONG K TELOK KURAU, Singapore",103.9114924,1.3130157
"LANDED HOUSING DEVELOPMENT, MERAGI CLOSE, Singapore",103.9599069,1.343136
"LANDED HOUSING DEVELOPMENT, JALAN KEMBOJA, Singapore",103.8736473,1.3315129
"LANDED HOUSING DEVELOPMENT, WILLOW AVENUE, Singapore",103.8749626,1.3335229
"LANDED HOUSING DEVELOPMENT, LORONG 110 CHANGI, Singapore",103.9098264,1.3177639
"LANDED HOUSING DEVELOPMENT, ENG KONG ROAD, Singapore",103.7682078,1.3354247
"LANDED HOUSING DEVELOPMENT, ENG KONG GARDEN, Singapore",103.7690482,1.3343037
"LANDED HOUSING DEVELOPMENT, TANAH MERAH BESAR LANE, Singapore",103.9756356,1.359347
"LANDED HOUSING DEVELOPMENT, BRIGHT HILL CRESCENT, Singapore",103.8324897,1.3560854
"LANDED HOUSING DEVELOPMENT, GREENBANK PARK, Singapore",103.7888645,1.3478931
"LANDED HOUSING DEVELOPMENT, SHELFORD ROAD, Singapore",103.8105676,1.3270327
"LANDED HOUSING DEVELOPMENT, LORONG ABU TALIB, Singapore",103.9286873,1.315715
"LANDED HOUSING DEVELOPMENT, JALAN WARINGIN, Singapore",103.9180756,1.3234356
"LANDED HOUSING DEVELOPMENT, KEE SUN AVENUE, Singapore",103.9286928,1.3107239
"LANDED HOUSING DEVELOPMENT, LUCKY VIEW, Singapore",103.9395085,1.3178965
"LANDED HOUSING DEVELOPMENT, OWEN ROAD, Singapore",103.852259,1.3146313
"LANDED HOUSING DEVELOPMENT, TANAH MERAH KECHIL ROAD SOUTH, Singapore",103.9466776,1.3217884
"LANDED HOUSING DEVELOPMENT, JALAN RAHMAT, Singapore",103.9082224,1.321338
"LANDED HOUSING DEVELOPMENT, ST. PATRICK'S ROAD, Singapore",103.912676,1.3080632
"LANDED HOUSING DEVELOPMENT, JALAN SINGA, Singapore",103.9073668,1.3307509
"LANDED HOUSING DEVELOPMENT, BEDOK RIA PLACE, Singapore",103.9514401,1.3271494
"LANDED HOUSING DEVELOPMENT, UPPER SERANGOON ROAD, Singapore",103.8824703,1.3576474
"LANDED HOUSING DEVELOPMENT, JALAN BANGAU, Singapore",103.8715735,1.3837432
"LANDED HOUSING DEVELOPMENT, HILLSIDE DRIVE, Singapore",103.877041,1.3580519
"LANDED HOUSING DEVELOPMENT, JALAN TARI PAYONG, Singapore",103.871391,1.3990466
"LANDED HOUSING DEVELOPMENT, LORONG KILAT, Singapore",103.7737058,1.3410296
"LANDED HOUSING DEVELOPMENT, FABER GROVE, Singapore",103.7557206,1.3228415
"LANDED HOUSING DEVELOPMENT, KOVAN CLOSE, Singapore",103.8810141,1.3589638
"LANDED HOUSING DEVELOPMENT, WISHART ROAD, Singapore",103.8139499,1.2701656
"LANDED HOUSING DEVELOPMENT, JALAN TANAH PUTEH, Singapore",103.9306721,1.3161737
"LANDED HOUSING DEVELOPMENT, JALAN SENYUM, Singapore",103.9144186,1.322296
"LANDED HOUSING DEVELOPMENT, LORONG SARI, Singapore",103.7870967,1.2800666
"LANDED HOUSING DEVELOPMENT, MERAGI TERRACE, Singapore",103.9598755,1.342448
"LANDED HOUSING DEVELOPMENT, FABER DRIVE, Singapore",103.7591298,1.3191653
"LANDED HOUSING DEVELOPMENT, ST. XAVIER'S LANE, Singapore",103.8984138,1.3714227
"LANDED HOUSING DEVELOPMENT, TOH CLOSE, Singapore",103.9711281,1.3637923
"LANDED HOUSING DEVELOPMENT, EAST COAST TERRACE, Singapore",103.9226997,1.3109327
"LANDED HOUSING DEVELOPMENT, TOH CRESCENT, Singapore",103.9730077,1.3657523
"LANDED HOUSING DEVELOPMENT, JALAN TAMBUR, Singapore",103.8295832,1.3645022
"LANDED HOUSING DEVELOPMENT, LORONG PISANG BATU, Singapore",103.7735312,1.3435555
"LANDED HOUSING DEVELOPMENT, MING TECK PARK, Singapore",103.788097,1.3197994
"LANDED HOUSING DEVELOPMENT, FABER GREEN, Singapore",103.7580335,1.319012
"LANDED HOUSING DEVELOPMENT, DUNEARN ROAD, Singapore",103.8090096,1.325467
"LANDED HOUSING DEVELOPMENT, TOH TUCK DRIVE, Singapore",103.7704562,1.3410807
"LANDED HOUSING DEVELOPMENT, FLORENCE CLOSE, Singapore",103.8862632,1.3621124
"LANDED HOUSING DEVELOPMENT, TOH YI ROAD, Singapore",103.7712818,1.3377047
"LANDED HOUSING DEVELOPMENT, RAMBAI ROAD, Singapore",103.9053773,1.3110077
"LANDED HOUSING DEVELOPMENT, WAREHAM ROAD, Singapore",103.8940297,1.3078658
"LANDED HOUSING DEVELOPMENT, KWONG AVENUE, Singapore",103.871092,1.3307213
"LANDED HOUSING DEVELOPMENT, SIXTH AVENUE, Singapore",103.7921606,1.3242223
"LANDED HOUSING DEVELOPMENT, JALAN LIM TAI SEE, Singapore",103.7935352,1.3216783
"LANDED HOUSING DEVELOPMENT, KING'S ROAD, Singapore",103.8073808,1.319338
"LANDED HOUSING DEVELOPMENT, JALAN MELATI, Singapore",103.883073,1.3290994
"LANDED HOUSING DEVELOPMENT, CHANCERY LANE, Singapore",103.8371596,1.3198919
"LANDED HOUSING DEVELOPMENT, SEA BREEZE ROAD, Singapore",103.9519879,1.3369547
"LANDED HOUSING DEVELOPMENT, LUCKY HEIGHTS, Singapore",103.9406252,1.317416
"LANDED HOUSING DEVELOPMENT, EAST COAST DRIVE, Singapore",103.9221512,1.3106953
"LANDED HOUSING DEVELOPMENT, LIM TAI SEE WALK, Singapore",103.79252,1.3225632
"LANDED HOUSING DEVELOPMENT, JALAN MERAH SAGA, Singapore",103.7984433,1.312072
"LANDED HOUSING DEVELOPMENT, GALISTAN AVENUE, Singapore",103.7595986,1.3781146
